{
  "format_version": "behavior-fixture-v1",
  "id": "FIX_REDUCE_BOUNDED",
  "class": "positive_trigger",
  "requirement_ids": [
    "REQ_REDUCE_SEED"
  ],
  "scenario": {
    "user_input": "Reduce /opt/data/5qln-lineage/corpus.txt to a seed — keep it bounded.",
    "context_files": [],
    "enabled_tools": [],
    "enabled_skills": [
      "5qln-fractal-data-loop"
    ]
  },
  "expected": {
    "trigger": "must",
    "assertions": [
      {
        "id": "ASSERT_ROOT",
        "kind": "output_contains",
        "value": "root ≡"
      },
      {
        "id": "ASSERT_RQ_SOURCE",
        "kind": "output_contains",
        "value": "∞0' source"
      },
      {
        "id": "ASSERT_ALPHA",
        "kind": "output_contains",
        "value": "alpha kind"
      }
    ]
  },
  "observation_policy": {
    "minimum_runs": 1,
    "require_fresh_session": true
  }
}